{
  "schema_version": "treecalc-corpus-v1",
  "theme": "references/literals-active",
  "workset": "W004",
  "status": "active",
  "description": "Focused W004 active slice for raw explicit reference-literal arrays through direct OxCalc context. All-resolved reference-only arrays execute through OxCalc ReferenceLiteralArrayV1; mixed scalar/reference arrays now execute through OxFml/OxFunc array semantics. DnaTreeCalc supplies formula text only and does not prepare carriers, resolve element paths, parse formula text, or inspect OxFml/OxFunc semantics.",
  "cases": [
    {
      "id": "lit-ref-array-two-members-active",
      "name": "reference literal source order executes through direct context",
      "spec": "§4, §6",
      "kind": "membership",
      "workspace": "reference-literals-active",
      "caller": "Root.Literals.SumAB",
      "reference": "{A,B}",
      "source_formula": "=SUM({A,B})",
      "elements": [
        { "kind": "reference", "path": "Root.Literals.A" },
        { "kind": "reference", "path": "Root.Literals.B" }
      ],
      "expect": {
        "outcome": "resolved",
        "ordered": true,
        "members": ["Root.Literals.A", "Root.Literals.B"],
        "published_value": "5",
        "engine_ref": "TreeCalcReferenceCollection::ReferenceLiteralArrayV1"
      }
    },
    {
      "id": "lit-ref-array-duplicates-preserved-active",
      "name": "explicit reference literal duplicates execute through direct context",
      "spec": "§3.5b, §6",
      "kind": "membership",
      "workspace": "reference-literals-active",
      "caller": "Root.Literals.SumDuplicate",
      "reference": "{A,A}",
      "source_formula": "=SUM({A,A})",
      "elements": [
        { "kind": "reference", "path": "Root.Literals.A" },
        { "kind": "reference", "path": "Root.Literals.A" }
      ],
      "expect": {
        "outcome": "resolved",
        "ordered": true,
        "members": ["Root.Literals.A", "Root.Literals.A"],
        "published_value": "4",
        "engine_ref": "TreeCalcReferenceCollection::ReferenceLiteralArrayV1"
      }
    },
    {
      "id": "lit-mixed-ref-scalar-reject-active",
      "name": "mixed reference/scalar array literal executes through direct context",
      "spec": "§4, §6",
      "kind": "membership",
      "workspace": "reference-literals-active",
      "caller": "Root.Literals.MixedReject",
      "reference": "{A,1}",
      "source_formula": "=SUM({A,1})",
      "profile": "treecalc-v1",
      "elements": [
        { "kind": "reference", "path": "Root.Literals.A" },
        { "kind": "scalar", "source_text": "1" }
      ],
      "expect": {
        "outcome": "resolved",
        "ordered": true,
        "members": ["Root.Literals.A"],
        "published_value": "3",
        "engine_ref": "TreeCalcReferenceCollection::ReferenceLiteralArrayV1 plus scalar array member"
      }
    }
  ]
}
