{
  "schema_version": "treecalc-corpus-v1",
  "theme": "tables/structured-references",
  "workset": "W004",
  "status": "active",
  "description": "Active table structured-reference surface (CORE_MODEL_SPEC section 3.3 and 7c): column refs, current-row refs, special items, composite refs, table column formulas, totals formulas, and update impact evidence. The runner executes these through DnaTreeCalc's real OxCalc table projection path and public OxCalc W056 table runtime APIs; DnaTreeCalc does not parse formula text.",
  "cases": [
    {
      "id": "tbl-column-ref",
      "name": "Table[Column] resolves to the table column reference",
      "spec": "section 3.3, section 7c",
      "kind": "table",
      "workspace": "tables",
      "caller": "Sheet1.Report",
      "table": "SalesTable",
      "reference": "SalesTable[Amount]",
      "source_formula": "=SUM(SalesTable[Amount])",
      "expect": {
        "outcome": "resolved",
        "target": "SalesTable.Columns.Amount",
        "target_kind": "column-reference",
        "selected_columns": ["col:amount"],
        "published_value": "60",
        "engine_ref": "structured-ref column lowered by OxFml/OxCalc"
      }
    },
    {
      "id": "tbl-path-current-row-ref",
      "name": "Table[@Column] resolves in caller row context",
      "spec": "section 3.3, section 7c",
      "kind": "table",
      "workspace": "tables",
      "caller": "SalesTable.Columns.Tax",
      "table": "SalesTable",
      "reference": "SalesTable[@Amount]",
      "source_formula": "=SalesTable[@Amount]",
      "caller_row_offset": 1,
      "expect": {
        "outcome": "resolved",
        "target": "SalesTable.Columns.Amount",
        "target_kind": "current-row-column-reference",
        "selected_columns": ["col:amount"],
        "published_value": "20",
        "engine_ref": "explicit table current-row structured-ref lowered by OxFml/OxCalc"
      }
    },
    {
      "id": "tbl-current-row-ref",
      "name": "[@Column] resolves in a column-formula row context",
      "spec": "section 3.3, section 7c",
      "kind": "table",
      "workspace": "tables",
      "caller": "SalesTable.Columns.Tax",
      "table": "SalesTable",
      "reference": "[@Amount]",
      "source_formula": "=[@Amount]",
      "caller_row_offset": 2,
      "expect": {
        "outcome": "resolved",
        "target": "SalesTable.Columns.Amount",
        "target_kind": "current-row-column-reference",
        "selected_columns": ["col:amount"],
        "published_value": "30",
        "engine_ref": "implicit current-row structured-ref lowered by OxFml/OxCalc"
      },
      "note": "The runner asserts row-context legality and per-row dependency shape through the table-node contract."
    },
    {
      "id": "tbl-special-headers",
      "name": "Table[#Headers] selects the header region",
      "spec": "section 3.3, section 7c",
      "kind": "table",
      "workspace": "tables",
      "caller": "Sheet1.Report",
      "table": "SalesTable",
      "reference": "SalesTable[#Headers]",
      "source_formula": "=COUNTA(SalesTable[#Headers])",
      "expect": {
        "outcome": "resolved",
        "target": "SalesTable.Headers",
        "target_kind": "header-region",
        "published_value": "3"
      }
    },
    {
      "id": "tbl-special-data-column",
      "name": "Table[[#Data],[Column]] selects the data region for one column",
      "spec": "section 3.3, section 7c",
      "kind": "table",
      "workspace": "tables",
      "caller": "Sheet1.Report",
      "table": "SalesTable",
      "reference": "SalesTable[[#Data],[Amount]]",
      "source_formula": "=SUM(SalesTable[[#Data],[Amount]])",
      "expect": {
        "outcome": "resolved",
        "target": "SalesTable.Columns.Amount",
        "target_kind": "data-column-reference",
        "selected_columns": ["col:amount"],
        "published_value": "60"
      }
    },
    {
      "id": "tbl-special-totals-column",
      "name": "Table[[#Totals],[Column]] selects a totals cell/region",
      "spec": "section 3.3, section 7c",
      "kind": "table",
      "workspace": "tables",
      "caller": "Sheet1.Report",
      "table": "SalesTable",
      "reference": "SalesTable[[#Totals],[Amount]]",
      "source_formula": "=SUM(SalesTable[[#Totals],[Amount]])",
      "expect": {
        "outcome": "resolved",
        "target": "SalesTable.Totals.Amount",
        "target_kind": "totals-column-reference",
        "selected_columns": ["col:amount"],
        "published_value": "60"
      }
    },
    {
      "id": "tbl-special-all",
      "name": "Table[#All] selects headers, data body, and totals where present",
      "spec": "section 3.3, section 7c",
      "kind": "table",
      "workspace": "tables",
      "caller": "Sheet1.Report",
      "table": "SalesTable",
      "reference": "SalesTable[#All]",
      "source_formula": "=COUNTA(SalesTable[#All])",
      "expect": {
        "outcome": "resolved",
        "target": "SalesTable",
        "target_kind": "all-region",
        "published_value": "13"
      }
    },
    {
      "id": "tbl-composite-data-columns",
      "name": "composite data column range resolves as a structured table selection",
      "spec": "section 3.3, section 7c",
      "kind": "table",
      "workspace": "tables",
      "caller": "Sheet1.Report",
      "table": "SalesTable",
      "reference": "SalesTable[[#Data],[Amount]:[Tax]]",
      "source_formula": "=SUM(SalesTable[[#Data],[Amount]:[Tax]])",
      "expect": {
        "outcome": "resolved",
        "target_kind": "composite-data-column-reference",
        "target": "",
        "selected_columns": ["col:amount", "col:tax"],
        "published_value": "66"
      }
    },
    {
      "id": "tbl-column-formula",
      "name": "table column formula binds and evaluates per row through structured refs",
      "spec": "section 7c",
      "kind": "table",
      "workspace": "tables",
      "caller": "SalesTable.Columns.Tax",
      "table": "SalesTable",
      "reference": "=[@Amount] * 0.1",
      "caller_row_offset": 0,
      "expect": {
        "outcome": "resolved",
        "target": "SalesTable.Columns.Amount",
        "target_kind": "column-formula-dependency",
        "selected_columns": ["col:amount"],
        "published_values": ["1", "2", "3"],
        "values_anchor": "excel-table"
      },
      "note": "TreeCalc asserts the structured-ref dependency and surfaced values; per-row evaluation semantics are Excel/OxFml/OxCalc anchored."
    },
    {
      "id": "tbl-totals-formula",
      "name": "table totals formula evaluates through sparse column reference",
      "spec": "section 7c",
      "kind": "table",
      "workspace": "tables",
      "caller": "SalesTable.Totals.Amount",
      "table": "SalesTable",
      "reference": "=SUM(SalesTable[Amount])",
      "expect": {
        "outcome": "resolved",
        "target": "SalesTable.Columns.Amount",
        "target_kind": "totals-formula-dependency",
        "selected_columns": ["col:amount"],
        "published_value": "60",
        "values_anchor": "excel-table"
      }
    },
    {
      "id": "tbl-unknown-column",
      "name": "unknown table column is a bind error",
      "spec": "section 3.3, section 7c",
      "kind": "table",
      "workspace": "tables",
      "caller": "Sheet1.Report",
      "table": "SalesTable",
      "reference": "SalesTable[Missing]",
      "source_formula": "=SUM(SalesTable[Missing])",
      "expect": {
        "outcome": "error",
        "reason": "not present"
      }
    },
    {
      "id": "tbl-escaped-table-column",
      "name": "bracket-escaped table and column names preserve source while resolving",
      "spec": "section 3.3, section 3.4, section 7c",
      "kind": "table",
      "workspace": "tables",
      "caller": "Sheet1.Report",
      "table": "Sales]Table",
      "reference": "[Sales]]Table][[Gross]]Amount]]",
      "source_formula": "=SUM([Sales]]Table][[Gross]]Amount]])",
      "expect": {
        "outcome": "resolved",
        "target": "Sales]Table.Columns.Gross]Amount",
        "target_kind": "escaped-column-reference",
        "selected_columns": ["col:gross-amount"],
        "engine_ref": "OxFml structured-reference packet pending for TreeCalc bracket-escaped table path"
      }
    },
    {
      "id": "tbl-escaped-current-row-column",
      "name": "bracket-escaped current-row column reference preserves caller row context",
      "spec": "section 3.3, section 3.4, section 7c",
      "kind": "table",
      "workspace": "tables",
      "caller": "Sales]Table",
      "table": "Sales]Table",
      "reference": "[Sales]]Table][[#This Row],[Gross]]Amount]]",
      "source_formula": "=[Sales]]Table][[#This Row],[Gross]]Amount]]",
      "caller_row_offset": 1,
      "expect": {
        "outcome": "resolved",
        "target": "Sales]Table.Columns.Gross]Amount",
        "target_kind": "escaped-current-row-column-reference",
        "selected_columns": ["col:gross-amount"],
        "published_value": "15",
        "engine_ref": "OxFml structured-reference packet pending for TreeCalc bracket-escaped current-row table path"
      }
    }
  ]
}
