{
  "schema_version": "treecalc-corpus-v1",
  "theme": "tables/empty-body",
  "workset": "W004",
  "status": "active",
  "description": "Active zero-row table corpus for headers-only and headers+totals tables. DnaTreeCalc owns these product table shapes and transition fixtures while consuming OxCalc/OxFml generic structured-reference packets and sparse readers through direct OxCalc context.",
  "cases": [
    {
      "id": "tbl-empty-headers-only-data",
      "name": "headers-only table #Data projects as a zero-row data reference",
      "spec": "section 7c",
      "kind": "table",
      "workspace": "empty-body-tables",
      "caller": "Report",
      "table": "EmptyHeadersOnly",
      "reference": "EmptyHeadersOnly[#Data]",
      "source_formula": "=COUNTA(EmptyHeadersOnly[#Data])",
      "expect": {
        "outcome": "resolved",
        "target": "",
        "target_kind": "composite-data-column-reference",
        "published_value": "0"
      }
    },
    {
      "id": "tbl-empty-headers-only-column",
      "name": "headers-only table [Col] projects as a zero-row data-column reference",
      "spec": "section 7c",
      "kind": "table",
      "workspace": "empty-body-tables",
      "caller": "Report",
      "table": "EmptyHeadersOnly",
      "reference": "EmptyHeadersOnly[Amount]",
      "source_formula": "=SUM(EmptyHeadersOnly[Amount])",
      "expect": {
        "outcome": "resolved",
        "target": "EmptyHeadersOnly.Columns.Amount",
        "target_kind": "data-column-reference",
        "selected_columns": ["col:amount"],
        "published_value": "0"
      }
    },
    {
      "id": "tbl-empty-headers-only-all",
      "name": "headers-only table #All projects headers without requiring data rows",
      "spec": "section 7c",
      "kind": "table",
      "workspace": "empty-body-tables",
      "caller": "Report",
      "table": "EmptyHeadersOnly",
      "reference": "EmptyHeadersOnly[#All]",
      "source_formula": "=COUNTA(EmptyHeadersOnly[#All])",
      "expect": {
        "outcome": "resolved",
        "target": "EmptyHeadersOnly",
        "target_kind": "all-region",
        "published_value": "1"
      }
    },
    {
      "id": "tbl-empty-headers-only-headers",
      "name": "headers-only table #Headers projects headers without requiring data rows",
      "spec": "section 7c",
      "kind": "table",
      "workspace": "empty-body-tables",
      "caller": "Report",
      "table": "EmptyHeadersOnly",
      "reference": "EmptyHeadersOnly[#Headers]",
      "source_formula": "=COUNTA(EmptyHeadersOnly[#Headers])",
      "expect": {
        "outcome": "resolved",
        "target": "EmptyHeadersOnly.Headers",
        "target_kind": "header-region",
        "published_value": "1"
      }
    },
    {
      "id": "tbl-empty-headers-totals-totals",
      "name": "headers+totals table #Totals projects totals without requiring data rows",
      "spec": "section 7c",
      "kind": "table",
      "workspace": "empty-body-tables",
      "caller": "Report",
      "table": "EmptyHeadersTotals",
      "reference": "EmptyHeadersTotals[#Totals]",
      "source_formula": "=COUNTA(EmptyHeadersTotals[#Totals])",
      "expect": {
        "outcome": "resolved",
        "target": "EmptyHeadersTotals.Totals",
        "target_kind": "totals-region",
        "published_value": "1"
      }
    },
    {
      "id": "tbl-empty-current-row-diagnostic",
      "name": "headers-only omitted [@Col] reports a typed no-current-row diagnostic",
      "spec": "section 7c",
      "kind": "table",
      "workspace": "empty-body-tables",
      "caller": "EmptyHeadersOnly",
      "table": "EmptyHeadersOnly",
      "reference": "[@Amount]",
      "source_formula": "=[@Amount]",
      "caller_row_offset": 0,
      "expect": {
        "outcome": "error",
        "reason": "CallerRowOutOfRange"
      }
    },
    {
      "id": "tbl-first-row-insert-endpoint",
      "name": "first-row insert endpoint projects and prebinds from the same table contract",
      "spec": "section 7c",
      "kind": "table",
      "workspace": "empty-body-tables",
      "caller": "Report",
      "table": "HeadersOnlyAfterFirstRowInsert",
      "reference": "HeadersOnlyAfterFirstRowInsert[Amount]",
      "source_formula": "=SUM(HeadersOnlyAfterFirstRowInsert[Amount])",
      "expect": {
        "outcome": "resolved",
        "target": "HeadersOnlyAfterFirstRowInsert.Columns.Amount",
        "target_kind": "data-column-reference",
        "selected_columns": ["col:amount"],
        "published_value": "1"
      }
    },
    {
      "id": "tbl-last-row-delete-endpoint",
      "name": "one-row before last-row delete projects through the same totals contract",
      "spec": "section 7c",
      "kind": "table",
      "workspace": "empty-body-tables",
      "caller": "Report",
      "table": "HeadersTotalsBeforeLastRowDelete",
      "reference": "HeadersTotalsBeforeLastRowDelete[[#Totals],[Amount]]",
      "source_formula": "=SUM(HeadersTotalsBeforeLastRowDelete[[#Totals],[Amount]])",
      "expect": {
        "outcome": "resolved",
        "target": "HeadersTotalsBeforeLastRowDelete.Totals.Amount",
        "target_kind": "totals-column-reference",
        "selected_columns": ["col:amount"],
        "published_value": "0"
      }
    }
  ]
}
