{
  "schema_version": "treecalc-corpus-v1",
  "theme": "references/set-membership",
  "workset": "W004",
  "status": "pending",
  "description": "Set-producing operators (CORE_MODEL_SPEC §3.5, §3.5b, §3.6) — which node-set each resolves to from a given caller, and order where it matters. Complements references/classification (which only pins single-vs-set cardinality). Carried as set-membership references (§3.7, §6 items 1/3); membership invalidates on structural change.",
  "cases": [
    { "id": "mem-children-sugar", "name": ".* yields the resolved node's children", "spec": "§3.2, §3.5b", "kind": "membership", "workspace": "accounts", "caller": "Accounts.2005", "reference": "Q1.*", "expect": { "outcome": "resolved", "ordered": true, "members": ["Accounts.2005.Q1.Income", "Accounts.2005.Q1.Margin", "Accounts.2005.Q1.Net"], "engine_ref": "children-set of Accounts.2005.Q1" }, "note": "Q1 resolves by walk-up; .* is its children in sibling order." },
    { "id": "mem-children-accessor", "name": "@CHILDREN yields the caller's children", "spec": "§3.5", "kind": "membership", "workspace": "accounts", "caller": "Accounts.2005.Q1", "reference": "@CHILDREN", "expect": { "outcome": "resolved", "ordered": true, "members": ["Accounts.2005.Q1.Income", "Accounts.2005.Q1.Margin", "Accounts.2005.Q1.Net"] }, "note": "@CHILDREN free-standing = THIS node's children (= .*)." },
    { "id": "mem-ancestors", "name": "@ANCESTORS yields enclosing nodes, closest first", "spec": "§3.5", "kind": "membership", "workspace": "accounts", "caller": "Accounts.2005.Q1.Income.Sales", "reference": "@ANCESTORS", "expect": { "outcome": "resolved", "ordered": true, "members": ["Accounts.2005.Q1.Income", "Accounts.2005.Q1", "Accounts.2005", "Accounts"] }, "note": "Closest-first, up to the named top-level node. The unnamed workspace root is reached via [] (§3.2), not enumerated here." },
    { "id": "mem-preceding", "name": "@PRECEDING yields earlier siblings in order", "spec": "§3.5", "kind": "membership", "workspace": "accounts", "caller": "Accounts.2005.Q1.Net", "reference": "@PRECEDING", "expect": { "outcome": "resolved", "ordered": true, "members": ["Accounts.2005.Q1.Income", "Accounts.2005.Q1.Margin"] }, "note": "Net is sibling-index 2 under Q1 [Income, Margin, Net]; preceding = the two earlier siblings." },
    { "id": "mem-preceding-empty", "name": "@PRECEDING of the first sibling is the empty set", "spec": "§3.5", "kind": "membership", "workspace": "accounts", "caller": "Accounts.2005.Q1.Income", "reference": "@PRECEDING", "expect": { "outcome": "resolved", "members": [] }, "note": "Income is the first sibling; an empty collection is a valid resolution, not Unresolved." },
    { "id": "mem-following", "name": "@FOLLOWING yields later siblings in order", "spec": "§3.5", "kind": "membership", "workspace": "accounts", "caller": "Accounts.2005.Q1.Income", "reference": "@FOLLOWING", "expect": { "outcome": "resolved", "ordered": true, "members": ["Accounts.2005.Q1.Margin", "Accounts.2005.Q1.Net"] } },
    { "id": "mem-recursive-descent-match", "name": "Foo.**.Bar gathers matching nodes at any depth", "spec": "§3.6", "kind": "membership", "workspace": "accounts", "caller": "Accounts.2005.Total", "reference": "Accounts.2005.**.Margin", "expect": { "outcome": "resolved", "members": ["Accounts.2005.Q1.Margin", "Accounts.2005.Q2.Margin"], "engine_ref": "set-membership reference (§6)" }, "note": "Every Margin at any depth under 2005." },
    { "id": "mem-recursive-descent-all", "name": "Foo.** gathers every descendant", "spec": "§3.6", "kind": "membership", "workspace": "accounts", "caller": "Accounts.2005.Total", "reference": "Q2.**", "expect": { "outcome": "resolved", "members": ["Accounts.2005.Q2.Margin", "Accounts.2005.Q2.Net"] }, "note": "All descendants of Q2 (it has no deeper nesting here)." }
  ]
}
